Health System,Hospital Name,Hospital Identifier in C-CDA,Associated Facility OID,Associated Health System OID
Ascension,Ascension Borgess Hospital ,Ascension Borgess Hospital,2.16.840.1.113883.3.891,2.16.840.1.113883.3.891
Ascension,Ascension Borgess-Lee Hospital,Ascension Borgess-Lee Hospital,2.16.840.1.113883.3.891.1,2.16.840.1.113883.3.891
Ascension,Ascension Genesys Hospital,Ascension Genesys Hospital,2.16.840.1.113883.3.1696,2.16.840.1.113883.3.1696
Ascension,"Ascension Macomb-Oakland Hospital, Madison Heights Campus","Ascension Macomb-Oakland Hospital, Madison Heights Campus",2.16.840.1.113883.17.3948,2.16.840.1.113883.3.4825
Ascension,"Ascension Macomb-Oakland Hospital, Warren Campus","Ascension Macomb-Oakland Hospital, Warren Heights Campus",2.16.840.1.113883.17.3945,2.16.840.1.113883.3.4825
Ascension,"Ascension Providence Hospital, Southfield Campus","Ascension Providence Hospital, Southfield Campus",2.16.840.1.113883.17.3950,2.16.840.1.113883.3.4825
Ascension,"Ascension Providence Park Hospital, Novi Campus","Ascension Providence Hospital, Novi Campus",2.16.840.1.113883.17.3951,2.16.840.1.113883.3.4825
Ascension,Ascension Providence Rochester Hospital,Ascension Providence Rochester District Hospital,2.16.840.1.113883.3.1364,2.16.840.1.113883.3.1364
Ascension,Ascension River District Hospital,Ascension River District Hospital,2.16.840.1.113883.17.3949,2.16.840.1.113883.3.4825
Ascension,Ascension St. John Hospital,Ascension St. John Hospital,2.16.840.1.113883.17.3943,2.16.840.1.113883.3.4825
Ascension,Ascension St. Joseph Hospital-Tawas,Ascension St. Joseph Hospital,2.16.840.1.113883.3.44.21.300,2.16.840.1.113883.3.44.21
Ascension,Ascension St. Mary's Hospital-Saginaw,Ascension St. Mary's Hospital,2.16.840.1.113883.3.44.21.100,2.16.840.1.113883.3.44.21
Ascension,Ascension Standish Hospital,Ascension Standish Hospital,2.16.840.1.113883.3.44.21.200,2.16.840.1.113883.3.44.21
Beaumont Health System,Beaumont Hospital - Dearborn,"Beaumont Health (Beaumont, Botsford, and Oakwood)",2.16.840.1.113883.3.5128,2.16.840.1.113883.3.1097
Beaumont Health System,Beaumont Hospital - Farmington Hills ,"Beaumont Health (Beaumont, Botsford, and Oakwood)",2.16.840.1.113883.3.1097.705,2.16.840.1.113883.3.1097
Beaumont Health System,Beaumont Hospital - Grosse Pointe,"Beaumont Health (Beaumont, Botsford, and Oakwood)",2.16.840.1.113883.3.1097.405,2.16.840.1.113883.3.1097
Beaumont Health System,Beaumont Hospital - Royal Oak,"Beaumont Health (Beaumont, Botsford, and Oakwood)",2.16.840.1.113883.3.1097.105,2.16.840.1.113883.3.1097
Beaumont Health System,Beaumont Hospital - Taylor,"Beaumont Health (Beaumont, Botsford, and Oakwood)",2.16.840.1.113883.3.5140,2.16.840.1.113883.3.1097
Beaumont Health System,Beaumont Hospital - Trenton,"Beaumont Health (Beaumont, Botsford, and Oakwood)",2.16.840.1.113883.3.5139,2.16.840.1.113883.3.1097
Beaumont Health System,Beaumont Hospital - Troy,"Beaumont Health (Beaumont, Botsford, and Oakwood)",2.16.840.1.113883.3.1097.205,2.16.840.1.113883.3.1097
Beaumont Health System,Beaumont Hospital - Wayne,"Beaumont Health (Beaumont, Botsford, and Oakwood)",2.16.840.1.113883.3.5141,2.16.840.1.113883.3.1097
Bronson Healthcare,Bronson Battle Creek Hospital,Bronson Healthcare Group,2.16.840.1.113883.3.137.4.70,2.16.840.1.113883.3.4771
Bronson Healthcare,Bronson Lakeview Hospital,Bronson Healthcare Group,2.16.840.1.113883.3.4771.2,2.16.840.1.113883.3.4771
Bronson Healthcare,Bronson Methodist Hospital,Bronson Healthcare Group,2.16.840.1.113883.3.4771.1,2.16.840.1.113883.3.4771
Bronson Healthcare,Bronson South Haven Hospital,Bronson Healthcare Group,2.16.840.1.113883.3.5023.1,2.16.840.1.113883.3.5023
Covenant Health,Covenant HealthCare,Covenant Health,2.16.840.1.113883.3.5044,2.16.840.1.113883.3.5044
Dickinson County Healthcare System,Dickinson County Memorial Hospital,DCH SYSTEM and Dickinson County Healthcare System,2.16.840.1.113883.3.4656.1,2.16.840.1.113883.3.4656
Detroit Medical Center,DMC Children's Hospital of Michigan-Detroit,Children's Hospital of Michigan,2.16.840.1.113883.3.801.4.5,2.16.840.1.113883.3.801
Detroit Medical Center,DMC Children's Hospital of Michigan-Troy,Children's Hospital of Michigan,2.16.840.1.113883.3.6769,2.16.840.1.113883.3.801
Detroit Medical Center,DMC Detroit Receiving Hospital,Detroit Receiving Hospital and University Health Center,2.16.840.1.113883.3.801.4.2,2.16.840.1.113883.3.801
Detroit Medical Center,DMC Harper University Hospital/DMC Hutzel Women's Hospital,Harper-Hutzel Hospital,2.16.840.1.113883.3.801.4.1,2.16.840.1.113883.3.801
Detroit Medical Center,DMC Huron Valley-Sinai Hospital,Huron Valley-Sinai Hospital,2.16.840.1.113883.3.801.4.4,2.16.840.1.113883.3.801
Detroit Medical Center,DMC Rehabilitation Institute of Michigan,Rehabilitation Institute of Michigan,2.16.840.1.113883.3.801.4.6,2.16.840.1.113883.3.801
Detroit Medical Center,DMC Sinai-Grace Hospital,Sinai-Grace Hospital,2.16.840.1.113883.3.801.4.3,2.16.840.1.113883.3.801
Prime Healthcare,Garden City Hospital,Garden City,2.16.840.1.113883.3.5416.1.85,2.16.840.1.113883.3.5416.1.85
Henry Ford Health System,Henry Ford Allegiance Health,Henry Ford Health System,2.16.840.1.113883.17.4042.4,2.16.840.1.113883.3.3823
Henry Ford Health System,Henry Ford Hospital - Main Campus,Henry Ford Health System,2.16.840.1.113883.3.3823.101,2.16.840.1.113883.3.3823
Henry Ford Health System,Henry Ford Hospital - Wyandotte,Henry Ford Health System,2.16.840.1.113883.3.3823.105,2.16.840.1.113883.3.3823
Henry Ford Health System,Henry Ford Macomb Hospital,Henry Ford Health System,2.16.840.1.113883.3.3823.106,2.16.840.1.113883.3.3823
Henry Ford Health System,Henry Ford West Bloomfield Hospital,Henry Ford Health System,2.16.840.1.113883.3.3823.104,2.16.840.1.113883.3.3823
Hillsdale Hospital,Hillsdale Hospital,Hillsdale Hospital,2.16.840.1.113883.3.4472,2.16.840.1.113883.3.4472
Holland Hospital,Holland Hospital,Holland Hospital,2.16.840.1.113883.3.1158,2.16.840.1.113883.3.1158
Hurley,Hurley Medical Center,Hurley Medical Center,2.16.840.1.113883.3.3413,2.16.840.1.113883.3.3413
McLaren Health Care,Karmanos Cancer Institute-Detroit,Karmanos Cancer Center,2.16.840.1.113883.3.4376.900,2.16.840.1.113883.3.4376
Prime Healthcare,Lake Huron Medical Center,PHS Michigan Service Area,2.16.840.1.113883.3.3238.50.958,2.16.840.1.113883.3.3238.50.958
Lakeland HealthCare,"Lakeland Hospital, Niles",Lakeland Regional Health System,2.16.840.1.113883.17.162,2.16.840.1.113883.3.3846
Lakeland HealthCare,"Lakeland Hospital, Watervliet",Lakeland Regional Health System,2.16.840.1.113883.17.159,2.16.840.1.113883.3.3846
Lakeland HealthCare,"Lakeland Medical Center, St. Joseph",Lakeland Regional Health System,2.16.840.1.113883.17.160,2.16.840.1.113883.3.3846
McLaren Health Care,McLaren Bay Region,Bay Regional Medical Center (Live),2.16.840.1.113883.3.4376.400,2.16.840.1.113883.3.4376
McLaren Health Care,McLaren Central Michigan,Central Michigan Community Hospital,2.16.840.1.113883.3.4376.700,2.16.840.1.113883.3.4376
McLaren Health Care,McLaren Flint,McLaren Regional Medical Center,2.16.840.1.113883.3.4376.100,2.16.840.1.113883.3.4376
McLaren Health Care,McLaren Greater Lansing,McLaren Greater Lansing,2.16.840.1.113883.3.4376.300,2.16.840.1.113883.3.4376
McLaren Health Care,McLaren Lapeer Region,Lapeer Regional Medical Center,2.16.840.1.113883.3.4376.200,2.16.840.1.113883.3.4376
McLaren Health Care,McLaren Macomb,Mount Clemens Regional Medical Center,2.16.840.1.113883.3.4376.600,2.16.840.1.113883.3.4376
McLaren Health Care,McLaren Northern Michigan,McLaren Northern Michigan,2.16.840.1.113883.3.4376.800,2.16.840.1.113883.3.4376
McLaren Health Care,McLaren Oakland,McLaren Oakland,2.16.840.1.113883.3.4376.500,2.16.840.1.113883.3.4376
McLaren Health Care,McLaren Port Huron,McLaren Port Huron,2.16.840.1.113883.3.4376.1100,2.16.840.1.113883.3.4376
Memorial Healthcare,Memorial Healthcare Owosso,Memorial Healthcare,2.16.840.1.113883.3.992,2.16.840.1.113883.3.992
Trinity Health,Mercy Health Hackley Campus,Mercy Health Muskegon,2.16.840.1.113883.3.137.30,2.16.840.1.113883.3.137
Trinity Health,Mercy Health Lakeshore Campus,Mercy Health Lakeshore Campus,2.16.840.1.113883.3.137.40,2.16.840.1.113883.3.137
Michigan Medicine - University of Michigan Health System,Metro Health Hospital,Metro Health Integrated Network,2.16.840.1.113883.3.3372,2.16.840.1.113883.3.3372
Michigan Medicine - University of Michigan Health System,Michigan Medicine - University of Michigan Medical Center,"Michigan Medicine, Unviersity of Michigan",2.16.840.1.113883.3.4220.4.10001,2.16.840.1.113883.3.4220
Mid-Michigan Health,MidMichigan Medical Center - Alpena,MidMichigan Medical Center,2.16.840.1.113883.3.1199,2.16.840.1.113883.3.1199
Mid-Michigan Health,MidMichigan Medical Center - Clare,MidMichigan Medical Center,2.16.840.1.113883.3.1738.1,2.16.840.1.113883.3.1738
Mid-Michigan Health,MidMichigan Medical Center - Gladwin,MidMichigan Medical Center,2.16.840.1.113883.3.1738.2,2.16.840.1.113883.3.1738
Mid-Michigan Health,MidMichigan Medical Center - Gratiot,MidMichigan Medical Center,2.16.840.1.113883.3.1738.3,2.16.840.1.113883.3.1738
Mid-Michigan Health,MidMichigan Medical Center - Midland,MidMichigan Medical Center,2.16.840.1.113883.3.1738.4,2.16.840.1.113883.3.1738
Michigan Medicine - University of Michigan Health System,Mott Children's Hospital,"Michigan Medicine, Unviersity of Michigan",2.16.840.1.113883.3.4220.4.10005,2.16.840.1.113883.3.4220
Munson Healthcare,Munson Healthcare Cadillac Hospital,Cadillac Hospital,2.16.840.1.113883.3.3252,2.16.840.1.113883.3.5416.1.33
Munson Healthcare,Munson Healthcare Grayling Hospital,Grayling Hospital,2.16.840.1.113883.3.3253,2.16.840.1.113883.3.5416.1.33
Munson Healthcare,Munson Healthcare Kalkaska Memorial Health Center,Kalkaska Memorial Health Center,2.16.840.1.113883.3.3255,2.16.840.1.113883.3.5416.1.33
Munson Healthcare,Munson Healthcare Munson Medical Center,Munson Medical Center,2.16.840.1.113883.3.1164,2.16.840.1.113883.3.5416.1.33
Munson Healthcare,Munson Healthcare Paul Oliver Memorial Hospital,Paul Oliver Memorial Hospital,2.16.840.1.113883.3.3254,2.16.840.1.113883.3.5416.1.33
North Ottawa Community Health System,North Ottawa Community Hospital,North Ottawa Community Hospital,2.16.840.1.113883.3.1939.1,2.16.840.1.113883.3.1939
Oaklawn Hospital,Oaklawn Hospital,Oaklawn Hospital,2.16.840.1.113883.3.1195,2.16.840.1.113883.3.1195
St. Francis Hospital,OSF St. Francis Hospital,OSF HEALTHCARE SA,2.16.840.1.113883.3.5416.1.117,2.16.840.1.113883.3.5416.1.359
ProMedica Health System,ProMedica Bixby Hospital,ProMedica Health System,2.16.840.1.113883.3.5416.1.81.2,2.16.840.1.113883.3.5416.1.81
ProMedica Health System,ProMedica Herrick Hospital,ProMedica Health System,2.16.840.1.113883.3.5416.1.81.1,2.16.840.1.113883.3.5416.1.81
ProMedica Health System,ProMedica Monroe Regional Hospital,ProMedica Health System,2.16.840.1.113883.3.5416.1.134.1,2.16.840.1.113883.3.5416.1.81
Sparrow Health System,Sparrow Carson City Hospital,Sparrow Health System,2.16.840.1.113883.3.3991.6,2.16.840.1.113883.3.3991
Sparrow Health System,Sparrow Clinton Hospital,Sparrow Health System,2.16.840.1.113883.3.3991.3,2.16.840.1.113883.3.3991
Sparrow Health System,Sparrow Eaton Hospital,Sparrow Health System,2.16.840.1.113883.3.3991.8,2.16.840.1.113883.3.3991
Sparrow Health System,Sparrow Hospital,Sparrow Health System,2.16.840.1.113883.3.3991.1,2.16.840.1.113883.3.3991
Sparrow Health System,Sparrow Ionia Hospital,Sparrow Health System,2.16.840.1.113883.3.3991.4,2.16.840.1.113883.3.3991
Sparrow Health System,Sparrow Speciaty Hospital,Sparrow Health System,2.16.840.1.113883.3.3991.5,2.16.840.1.113883.3.3991
Trinity Health,St. Joseph Mercy Chelsea,St. Joseph Mercy Chelsea,2.16.840.1.113883.3.137.230,2.16.840.1.113883.3.137
Trinity Health,St. Joseph Mercy Hospital,"St. Joseph Mercy Hospital, Ann Arbor",2.16.840.1.113883.3.137.210,2.16.840.1.113883.3.137
Trinity Health,St. Joseph Mercy Livingston Hospital,St. Joseph Mercy Livingston Hospital,2.16.840.1.113883.3.137.220,2.16.840.1.113883.3.137
Trinity Health,St. Joseph Mercy Oakland,St. Joseph Mercy- Oakland,2.16.840.1.113883.3.137.250,2.16.840.1.113883.3.137
Trinity Health,St. Mary Mercy Hospital,St. Mary Mercy Hospital - Livonia,2.16.840.1.113883.3.137.240,2.16.840.1.113883.3.137
Trinity Health,St. Mary's Mercy Medical Center,Mercy Health Saint Mary's,2.16.840.1.113883.3.137.10,2.16.840.1.113883.3.137
Sturgis Hospital,Sturgis Hospital,Sturgis Hospital,2.16.840.1.113883.3.3571.1,2.16.840.1.113883.3.3571
Michigan Medicine - University of Michigan Health System,University Hospital South - Michigan Medicine,"Michigan Medicine, Unviersity of Michigan",2.16.840.1.113883.3.4220.4.10009,2.16.840.1.113883.3.4220
UP Health System (part of LifePoint Hospitals),UP Health System - Marquette,UP HEALTH SYSTEM-MARQUETTE,2.16.840.1.113883.3.2533,2.16.840.1.113883.3.2533
Michigan Medicine - University of Michigan Health System,Von Voigtlander Women's Hospital,"Michigan Medicine, Unviersity of Michigan",2.16.840.1.113883.3.4220.4.10003,2.16.840.1.113883.3.4220
War Memorial Hospital,War Memorial Hospital,War Memorial Hospital,2.16.840.1.113883.3.1145.2,2.16.840.1.113883.3.1145
,,,,
,,,,
